{
  "name": "IconButton",
  "summary": "以图标触发常用动作，并可在图标后同行显示文字标签",
  "status": "beta",
  "import": "import { IconButton } from '@qhkg/react'",
  "storybookId": "actions-iconbutton",
  "whenToUse": ["工具栏中的熟悉动作", "需要用文字标签补充图标含义的紧凑操作"],
  "avoidWhen": ["不包含图标的普通操作", "用于页面导航"],
  "mobile": [
    "纯图标模式默认触控区域为 44px 方形",
    "带标签模式保持图标与文字同行并允许容器自然扩展",
    "不能只在悬停时显示"
  ],
  "accessibility": [
    "纯图标模式必须提供 aria-label",
    "带标签模式默认使用可见文字作为可访问名称",
    "图标本身从辅助技术中隐藏",
    "loading 时阻止重复激活"
  ],
  "related": ["Button", "Tooltip"],
  "stories": [
    "Default",
    "Playground",
    "WithLabel",
    "States",
    "Loading",
    "Disabled",
    "LongContent",
    "Mobile"
  ]
}
