{
  "name": "Inline",
  "summary": "使用设计 Token 间距横向排列并按需换行",
  "status": "beta",
  "import": "import { Inline } from '@qhkg/react'",
  "storybookId": "layout-inline",
  "whenToUse": ["操作按钮横向排列", "标签和元数据需要自动换行"],
  "avoidWhen": ["内容应纵向排列", "需要严格二维列结构"],
  "mobile": ["默认允许换行，避免页面横向溢出"],
  "accessibility": ["只负责视觉排列，不改变阅读顺序"],
  "related": ["Stack", "Grid"],
  "stories": ["Default", "Playground", "States", "LongContent", "Mobile"]
}
