{
  "name": "AlertDialog",
  "summary": "要求用户明确确认或取消高风险、不可逆操作",
  "status": "beta",
  "import": "import { AlertDialog } from '@qh-design/react'",
  "storybookId": "overlays-alertdialog",
  "whenToUse": ["操作不可逆或会造成明显损失", "必须阻止误触并要求明确选择"],
  "avoidWhen": ["只是告知结果", "任务是普通编辑或设置"],
  "mobile": ["危险操作与取消操作纵向排列", "安全的取消操作在视觉和焦点上优先"],
  "accessibility": [
    "必须提供 Title 和 Description",
    "打开后默认聚焦 Cancel",
    "Escape 等同取消且不会执行 Action"
  ],
  "related": ["Dialog", "Alert", "Toast"],
  "stories": ["Default", "Playground", "Open", "LongContent", "Mobile"]
}
