{
  "name": "Tooltip",
  "summary": "在悬停或键盘聚焦时显示简短的非交互说明",
  "status": "beta",
  "import": "import { Tooltip } from '@qhkg/react'",
  "storybookId": "overlays-tooltip",
  "whenToUse": ["解释图标按钮或陌生术语", "补充一句不影响任务的说明"],
  "avoidWhen": ["提示包含按钮或链接", "信息对完成任务至关重要"],
  "mobile": [
    "不把 Tooltip 作为触屏用户获取关键信息的唯一方式",
    "内容自动避让视口边缘"
  ],
  "accessibility": [
    "键盘聚焦与悬停都可触发",
    "内容通过描述关系关联触发器",
    "Tooltip 内不放交互控件"
  ],
  "related": ["Popover", "IconButton"],
  "stories": ["Default", "Playground", "KeyboardFocus", "LongContent", "Mobile"]
}
