{
  "name": "Drawer",
  "summary": "从屏幕底部展开适合移动端的模态任务面板",
  "status": "beta",
  "import": "import { Drawer } from '@qhkg/react'",
  "storybookId": "overlays-drawer",
  "whenToUse": [
    "移动端需要展示筛选、分享或短表单",
    "内容比 Popover 多但仍属于当前上下文"
  ],
  "avoidWhen": ["只是显示一句提示", "桌面端需要复杂且长期存在的侧栏"],
  "mobile": [
    "从底部进入并适配安全区域",
    "最大高度使用动态视口且内容可滚动",
    "操作区域保持在内容底部"
  ],
  "accessibility": [
    "语义和焦点行为与 Dialog 一致",
    "必须提供 Title 和 Description",
    "Escape 与关闭操作会还原焦点"
  ],
  "related": ["Dialog", "Popover"],
  "stories": [
    "Default",
    "Playground",
    "Open",
    "LongContent",
    "Mobile",
    "WithDialogLoaded"
  ]
}
